{
  "$schema": "http://json-schema.org/draft-07/schema#",
  "$id": "https://minishop.local/contracts/buy-intent-command.schema.json",
  "title": "BuyIntentCommand",
  "type": "object",
  "additionalProperties": false,
  "required": [
    "command_id",
    "correlation_id",
    "buyer_id",
    "items",
    "metadata",
    "issued_at"
  ],
  "properties": {
    "command_id": {
      "type": "string",
      "pattern": "^[0-9a-fA-F]{8}-[0-9a-fA-F]{4}-[0-9a-fA-F]{4}-[0-9a-fA-F]{4}-[0-9a-fA-F]{12}$"
    },
    "correlation_id": {
      "type": "string",
      "pattern": "^[0-9a-fA-F]{8}-[0-9a-fA-F]{4}-[0-9a-fA-F]{4}-[0-9a-fA-F]{4}-[0-9a-fA-F]{12}$"
    },
    "buyer_id": {
      "type": "string",
      "minLength": 1
    },
    "items": {
      "type": "array",
      "minItems": 1,
      "items": {
        "type": "object",
        "additionalProperties": false,
        "required": [
          "sku_id",
          "quantity",
          "unit_price_amount_minor",
          "currency"
        ],
        "properties": {
          "sku_id": {
            "type": "string",
            "minLength": 1
          },
          "quantity": {
            "type": "integer",
            "minimum": 1
          },
          "unit_price_amount_minor": {
            "type": "integer",
            "minimum": 0
          },
          "currency": {
            "type": "string",
            "pattern": "^[A-Z]{3}$"
          }
        }
      }
    },
    "idempotency_key": {
      "type": "string",
      "minLength": 1
    },
    "metadata": {
      "type": "object",
      "additionalProperties": false,
      "required": [
        "request_id",
        "trace_id",
        "source",
        "actor_id"
      ],
      "properties": {
        "request_id": {
          "type": "string",
          "minLength": 1
        },
        "trace_id": {
          "type": "string",
          "minLength": 1
        },
        "source": {
          "type": "string",
          "enum": ["web", "api", "worker", "benchmark"]
        },
        "actor_id": {
          "type": "string",
          "minLength": 1
        }
      }
    },
    "issued_at": {
      "type": "string",
      "pattern": "^\\d{4}-\\d{2}-\\d{2}T\\d{2}:\\d{2}:\\d{2}(?:\\.\\d{1,9})?(?:Z|[+-]\\d{2}:\\d{2})$"
    }
  }
}
