{
  "command_id": "11111111-1111-4111-8111-111111111111",
  "correlation_id": "22222222-2222-4222-8222-222222222222",
  "buyer_id": "buyer_1",
  "items": [
    {
      "sku_id": "sku_hot_001",
      "quantity": 1,
      "unit_price_amount_minor": 1200,
      "currency": "TWD"
    }
  ],
  "idempotency_key": "idem_1",
  "metadata": {
    "request_id": "req_1",
    "trace_id": "trace_1",
    "source": "web",
    "actor_id": "buyer_1"
  },
  "issued_at": "2026-04-20T03:00:00.000Z"
}
